2512,143.4511111111111,-14.615,250,120,61,2222,340,146,194,268,225,275,218,1189,304,2,113,834,9,509,14,Eucalyptus brassiana,1999,Eucalyptus,Symphyomyrtus,Exsertaria,Exsertae,Exsertae,brassiana,NA,Eucalyptus brassiana,NA,NA,tree,NA,15,120,6,6,20000,25,180,12,14,20000,20,150,9,10,"Tree to 20 m. Bark rough, thick, hard, dark grey to approx 2 m, then smooth and grey, cream-yellow or blue-grey above. Juvenile leaves lanceolate, green, slightly discolorous. Adult leaves lanceolate to narrowly lanceolate, acuminate, thin; lamina 12-18 cm long, 1.5-2.5 cm wide, green; lateral veins at 30°–50°; intramarginal vein up to 2 mm from margin; petiole channelled or slightly flattened, 12-22 mm long. Umbels 3-7-flowered; peduncle slightly angular, 10-20 mm long; pedicels 5-10 mm long. Buds conical; operculum conical, 7-10 mm long, 5-7 mm wide; hypanthium hemispherical, 3-4 mm long, 5-7 mm wide. Fruits ovoid to subglobular, 6-14 mm long, 6-12 mm wide; disc very broad, ascending steeply; valves 4 or 5, strongly exserted. Seeds brown-black. Cape. York Red. Gum. Fig. 92C–D","Flora of Australia Volume 19, Myrtaceae, Eucalyptus, Angophora, Australian Government Publishing Service, Canberra (1988)"
2514,143.43972222222223,-14.599166666666667,250,120,61,2222,340,146,194,268,225,275,218,1189,304,2,113,834,9,509,14,Eucalyptus drepanophylla,1999,Eucalyptus,Symphyomyrtus,Adnataria,Siderophloiae,NA,drepanophylla,NA,Eucalyptus drepanophylla,NA,NA,tree,NA,14,100,5,4,30000,25,150,6,6,30000,19.5,125,5.5,5,"Tree to 30 m. Bark rough on trunk and larger branches or throughout, dark grey to black. Juvenile leaves elliptic to ovate, light green, concolorous. Adult leaves lanceolate to narrowly lanceolate, acuminate; lamina 10-15 cm long, 1.4-2.5 cm wide, green or grey-green; lateral veins faint, at 30°–40°; intramarginal vein up to 1 mm from margin; petiole 10-20 mm long. Conflorescence terminal and axillary, paniculate; umbels 7-flowered; peduncle terete, rarely quadrangular, 4-7 mm long; pedicels 3-6 mm long. Buds obovoid or obconical; operculum hemispherical–conical, approx 3 mm long, approx 4 mm wide; hypanthium obconical, 3-4 mm long, c. 4 mm wide. Fruits hemispherical to subcylindrical, 4-6 mm long, 5-6 mm wide; disc narrow, descending; valves usually 4, level to exserted. Queensland. Grey Ironbark. Fig. 105A–B","Flora of Australia Volume 19, Myrtaceae, Eucalyptus, Angophora, Australian Government Publishing Service, Canberra (1988)"
2520,144.75194444444443,-16.202777777777776,236,108,61,2277,319,142,177,255,210,261,203,1338,311,10,99,863,38,546,48,Eucalyptus staigeriana,1999,Eucalyptus,Symphyomyrtus,Adnataria,Siderophloiae,NA,staigeriana,NA,Eucalyptus staigeriana,NA,NA,tree,NA,12,40,4,5,21000,20,100,5,6,21000,16,70,4.5,5.5,"Tree to 21 m. Bark rough throughout, dark grey to black, deeply fissured. Juvenile leaves ovate to elliptic, green, concolorous. Adult leaves lanceolate, to elliptic, obtuse, apiculate; lamina 4-10 cm long, 1.2-2 cm wide, green; lateral veins faint, at 40°–45°; intramarginal vein up to 1 mm from margin; petiole 8-14 mm long. Conflorescence axillary and terminal, paniculate; umbels 7-11-flowered; peduncle terete, 8-13 mm long; pedicels 3-7 mm long. Buds fusiform; operculum conical, 2-3 mm long, 3-4 mm wide; hypanthium obconical, 3-4 mm long and wide. Fruits ovoid to pyriform, 5-6 mm long, 4-5 mm wide; disc narrow, descending; valves 3 or 4, ±level. Lemon-scented. Ironbark. Fig. 105 I–J","Flora of Australia Volume 19, Myrtaceae, Eucalyptus, Angophora, Australian Government Publishing Service, Canberra (1988)"
2521,144.7361111111111,-16.378333333333334,239,111,60,2312,325,143,182,258,213,265,206,1305,305,9,101,849,34,548,42,Eucalyptus tardecidens,1999,Eucalyptus,Symphyomyrtus,Adnataria,Buxeales,Subplatyphyllae,tardecidens,NA,NA,NA,NA,NA,NA,NA,NA,NA,NA,NA,NA,NA,NA,NA,NA,NA,NA,NA,NA,NA,NA
2532,145.51472222222222,-20.266111111111112,227,131,53,3964,340,94,246,264,184,270,170,696,159,9,85,399,39,395,47,Eucalyptus drepanophylla,1999,Eucalyptus,Symphyomyrtus,Adnataria,Siderophloiae,NA,drepanophylla,NA,Eucalyptus drepanophylla,NA,NA,tree,NA,14,100,5,4,30000,25,150,6,6,30000,19.5,125,5.5,5,"Tree to 30 m. Bark rough on trunk and larger branches or throughout, dark grey to black. Juvenile leaves elliptic to ovate, light green, concolorous. Adult leaves lanceolate to narrowly lanceolate, acuminate; lamina 10-15 cm long, 1.4-2.5 cm wide, green or grey-green; lateral veins faint, at 30°–40°; intramarginal vein up to 1 mm from margin; petiole 10-20 mm long. Conflorescence terminal and axillary, paniculate; umbels 7-flowered; peduncle terete, rarely quadrangular, 4-7 mm long; pedicels 3-6 mm long. Buds obovoid or obconical; operculum hemispherical–conical, approx 3 mm long, approx 4 mm wide; hypanthium obconical, 3-4 mm long, c. 4 mm wide. Fruits hemispherical to subcylindrical, 4-6 mm long, 5-6 mm wide; disc narrow, descending; valves usually 4, level to exserted. Queensland. Grey Ironbark. Fig. 105A–B","Flora of Australia Volume 19, Myrtaceae, Eucalyptus, Angophora, Australian Government Publishing Service, Canberra (1988)"
2533,145.31611111111113,-20.480555555555554,229,135,53,4113,345,93,252,268,185,274,171,687,156,9,85,393,39,391,46,Eucalyptus quadricostata,1999,Eucalyptus,Symphyomyrtus,Adnataria,Siderophloiae,NA,quadricostata,NA,Eucalyptus quadricostata,NA,NA,tree,NA,15,110,8,10,6000,22,150,10,14,6000,18.5,130,9,12,"Tree to 6 m. Bark rough throughout, grey-black, furrowed. Juvenile leaves ovate, dull, grey-green, concolorous. Adult leaves lanceolate, acuminate; lamina 11-15 cm long, 1.5-2.2 cm wide, dull, green; lateral veins just visible, at 30°–40°; intramarginal vein 1-2 mm from margin; petiole 13-27 mm long. Conflorescence terminal, paniculate, with some axillary umbels; umbels 7-flowered; peduncle slightly flattened, 12-20 mm long; pedicels 5-6 mm long. Buds clavate; operculum pyramidal, 4-6 mm long, 5-6 mm wide; hypanthium quadrangular, 6-7 mm long, 5-6 mm wide. Fruits ovoid, quadrangular, 10-14 mm long, 8-10 mm wide; disc narrow, descending; valves 4, level or slightly exserted. Fig. 106A–B. Figure 105. Eucalyptus buds and fruits, all ×1. A–B, E. drepanophylla (A, I.Brooker 5293, FRI; B, D.Kleinig 252, FRI). C–D, E. crebra (C, cult., Waite. Arboretum, S.A., N.Hall & D.Symon, FRI; D, G.Smith 15, FRI). E–F, E. cullenii (E, I.Brooker 3368, FRI; F, I.Brooker 4071, FRI). G–H, E. whitei (G, I.Brooker 3353, FRI; H, I.Brooker 4142, FRI). I–J, E. staigeriana (I, B.Hyland 7929, FRI; J, I.Brooker 4015, FRI). K–L, E. jensenii (K, C.Gardner 9954, FRI; L, I.Brooker 3130, FRI). A, B, E, F drawn by M.Risby. Others drawn by M.May","Flora of Australia Volume 19, Myrtaceae, Eucalyptus, Angophora, Australian Government Publishing Service, Canberra (1988)"
2536,145.03194444444446,-20.984722222222224,233,139,52,4400,354,90,264,281,186,281,170,561,126,7,84,319,32,319,40,Eucalyptus whitei,1999,Eucalyptus,Symphyomyrtus,Adnataria,Siderophloiae,NA,whitei,NA,Eucalyptus whitei,NA,NA,tree,NA,10,75,4,5,17000,20,130,5,8,17000,15,102.5,4.5,6.5,"Tree to 17 m. Bark rough throughout, brown-grey to dark grey, deeply fissured. Juvenile leaves broadly lanceolate to ovate, light green, slightly discolorous. Adult leaves narrowly lanceolate, sometimes falcate, acute; lamina 7.5-13 cm long, 1-2 cm wide, glaucous; lateral veins faint, at 40°–50°; intramarginal vein up to 1 mm from margin; petiole 6-10 mm long. Conflorescence axillary and terminal panicles, and some axillary umbels; umbels 7-flowered; peduncle terete, 10-18 mm long; pedicels 2-5 mm long. Buds fusiform, sometimes glaucous; operculum conical, 2-4 mm long, approx 3 mm wide; hypanthium obconical, 3-4 mm long, approx 3 mm wide. Fruits ovoid, sometimes glaucous, 5-8 mm long, 4-5 mm wide; disc narrow, steeply descending; valves 4 or 5, included. White’s Ironbark. Fig. 105G–H","Flora of Australia Volume 19, Myrtaceae, Eucalyptus, Angophora, Australian Government Publishing Service, Canberra (1988)"
2545,151.27555555555557,-24.1975,216,111,52,3686,311,98,213,258,173,258,163,946,159,28,56,432,100,432,109,Eucalyptus decolor,1999,Eucalyptus,Symphyomyrtus,Adnataria,Rhodoxyla,Discolores,decolor,NA,NA,NA,NA,NA,NA,NA,NA,NA,NA,NA,NA,NA,NA,NA,NA,NA,NA,NA,NA,NA,NA
2549,148.6577777777778,-25.30388888888889,190,153,51,5213,327,30,297,251,133,251,118,677,104,18,48,293,82,293,94,Eucalyptus panda,1999,Eucalyptus,Symphyomyrtus,Adnataria,Siderophloiae,NA,panda,NA,Eucalyptus panda,NA,NA,tree,NA,8,55,5,4,20000,25,100,6,5,20000,16.5,77.5,5.5,4.5,"Tree, often straggly, to 20 m. Bark rough throughout, grey. Juvenile leaves narrowly lanceolate, grey-green, concolorous. Adult leaves lanceolate to broadly lanceolate, apiculate or acuminate; lamina 5.5-10 cm long, 0.8-2.5 cm wide, dull, grey-green, concolorous; lateral veins faint, at 45°–50°; intramarginal vein up to 1 mm from margin; petiole 7-15 mm long. Peduncle terete, 4-7 mm long; pedicels terete, 2-4 mm long. Buds fusiform; operculum conical, often narrower than hypanthium, 2-4 mm long, 3-4 mm wide; hypanthium obconical, approx 4 mm long, 4-5 mm wide. Fruits hemispherical or obconical, 4-5 mm long, 5-6 mm wide; disc narrow, descending; valves 4 or 5, included to slightly exserted. Seeds smooth. Tumbledown. Ironbark. Fig. 108C–D","Flora of Australia Volume 19, Myrtaceae, Eucalyptus, Angophora, Australian Government Publishing Service, Canberra (1988)"
2553,148.16916666666665,-28.703333333333333,203,142,47,5804,349,48,301,274,125,274,125,464,71,22,35,172,78,172,78,Eucalyptus camaldulensis subsp. acuta,1999,Eucalyptus,Symphyomyrtus,Exsertaria,Exsertae,Rostratae,camaldulensis,acuta,NA,NA,NA,NA,NA,NA,NA,NA,NA,NA,NA,NA,NA,NA,NA,NA,NA,NA,NA,NA,NA
2554,146.84555555555556,-30.390555555555554,196,141,46,5879,350,45,305,263,132,269,118,430,55,21,29,150,77,141,79,Eucalyptus intertexta,1999,Eucalyptus,Symphyomyrtus,Adnataria,Buxeales,Subplatyphyllae,intertexta,NA,Eucalyptus intertexta,NA,NA,tree,NA,10,70,4,4,30000,20,140,7,9,30000,15,105,5.5,6.5,"Tree to 30 m. Bark rough on lower trunk, then smooth and white, grey or brown above, often in patches. Adult leaves narrowly to broadly lanceolate, acute to acuminate; lamina 7-14 cm long, 1-2 cm wide, green, grey-green or dull green; lateral veins clearly visible, at 25°–35°; intramarginal vein up to 1 mm from margin; petiole terete, 5-15 mm long. Peduncle angular, 5-16 mm long; pedicels angular, 3-9 mm long. Operculum conical, 2-4 mm long, 3-4 mm wide; hypanthium obconical to obovoid, approx 4 mm long, 3-4 mm wide. Fruits hemispherical to ovoid, 4-9 mm long, 4-7 mm wide; disc descending; valves 4 or 5, level or included. Gum-barked. Coolibah. Fig. 101E–F","Flora of Australia Volume 19, Myrtaceae, Eucalyptus, Angophora, Australian Government Publishing Service, Canberra (1988)"
2555,141.25694444444446,-31.888333333333332,177,131,45,5533,327,42,285,177,105,247,105,245,27,14,18,68,49,65,49,Eucalyptus camaldulensis subsp. arida,1999,Eucalyptus,Symphyomyrtus,Exsertaria,Exsertae,Rostratae,camaldulensis,arida,NA,NA,NA,NA,NA,NA,NA,NA,NA,NA,NA,NA,NA,NA,NA,NA,NA,NA,NA,NA,NA
2566,138.02694444444447,-32.705555555555556,156,131,48,5089,303,34,269,91,218,221,91,540,70,22,40,199,69,71,199,Eucalyptus leucoxylon subsp. pruinosa,1999,Eucalyptus,Symphyomyrtus,Adnataria,Melliodorae,NA,leucoxylon,pruinosa,NA,NA,NA,NA,NA,NA,NA,NA,NA,NA,NA,NA,NA,NA,NA,NA,NA,NA,NA,NA,NA
2577,146.76416666666665,-43.230555555555554,67,68,46,2771,153,6,147,34,103,103,31,1531,161,84,17,459,288,288,433,Eucalyptus vernicosa,2000,Eucalyptus,Symphyomyrtus,Maidenaria,Semiunicolores,NA,vernicosa,NA,Eucalyptus vernicosa,NA,NA,NA,NA,10,15,5,5,NA,15,25,9,8,NA,12.5,20,7,6.5,"Bark smooth throughout, grey. Juvenile leaves opposite, sessile, elliptic to ovate, crenulate, mucronate, shining, green, slightly discolorous. Adult leaves opposite, elliptic to ovate, mucronate; lamina 1.5-2.5 cm long, 1-1.5 cm wide, shining, green, concolorous; lateral veins faint, at 45°–50°; intramarginal vein up to 1 mm from margin; petiole channelled, 5-8 mm long. Umbels 3-flowered; peduncle absent or terete to 2 mm long; pedicels absent. Buds ovoid; operculum conical, 3-5 mm long, 3-6 mm wide; hypanthium campanulate, 3-5 mm long, 3-6 mm wide. Fruits hemispherical to campanulate, ribbed, 5-8 mm long, 5-9 mm wide; disc broad, descending; valves 3 or 4, level or just exserted. Varnished. Gum. Fig. 95 O–P","Flora of Australia Volume 19, Myrtaceae, Eucalyptus, Angophora, Australian Government Publishing Service, Canberra (1988)"
2581,141.6511111111111,-36.55888888888889,142,135,51,4359,291,31,260,87,197,198,87,485,61,23,32,167,73,75,167,Eucalyptus leucoxylon subsp. stephaniae,2000,Eucalyptus,Symphyomyrtus,Adnataria,Melliodorae,NA,leucoxylon,stephaniae,NA,NA,NA,NA,NA,NA,NA,NA,NA,NA,NA,NA,NA,NA,NA,NA,NA,NA,NA,NA,NA
2583,141.73555555555555,-36.678888888888885,141,133,51,4271,289,32,257,87,196,196,87,494,62,23,33,171,72,74,171,Eucalyptus froggattii,2000,Eucalyptus,Symphyomyrtus,Adnataria,Subbuxeales,NA,froggattii,NA,Eucalyptus froggattii,NA,NA,mallee,NA,12,75,5,6,6000,20,120,8,8,6000,16,97.5,6.5,7,"Mallee to 6 m or tree to 9 m. Bark rough, fibrous, grey to grey-brown on stems or trunk, then smooth and green-brown above. Juvenile leaves elliptic to lanceolate, green, slightly discolorous. Adult leaves lanceolate, acute; lamina 7.5-12 cm long, 1.2-2 cm wide, shining, green; lateral veins faint, at 15°–25°; intramarginal vein prominent, up to 3 mm from margin; petiole slightly flattened, 7-12 mm long. Conflorescence usually terminal panicles, sometimes axillary, simple; umbels 7-11-flowered; peduncle flattened, 7-15 mm long; pedicels 4-6 mm long. Buds quadrangular, clavate to ovoid; operculum pyramidal, 4-5 mm long, 4-6 mm wide; hypanthium ovoid to obpyramidal, 5-7 mm long, 4-5 mm wide. Fruits ovoid to cylindrical, quadrangular, 6-8 mm long, 5-8 mm wide; disc broad, descending; valves 4 or 5, included. Kamarooka. Mallee. Fig. 104C–D","Flora of Australia Volume 19, Myrtaceae, Eucalyptus, Angophora, Australian Government Publishing Service, Canberra (1988)"
2584,142.51444444444445,-37.17194444444444,118,118,49,4184,260,20,240,71,172,172,65,913,119,37,36,330,123,123,328,Eucalyptus serraensis,2000,Eucalyptus,Eucalyptus,Eucalyptus,Pachyphloiae,NA,serraensis,NA,NA,NA,NA,NA,NA,NA,NA,NA,NA,NA,NA,NA,NA,NA,NA,NA,NA,NA,NA,NA,NA
2677,126.44027777777778,-27.203333333333333,207,150,46,6118,369,45,324,280,214,280,125,181,22,6,27,56,30,56,46,Eucalyptus intertexta,2000,Eucalyptus,Symphyomyrtus,Adnataria,Buxeales,Subplatyphyllae,intertexta,NA,Eucalyptus intertexta,NA,NA,tree,NA,10,70,4,4,30000,20,140,7,9,30000,15,105,5.5,6.5,"Tree to 30 m. Bark rough on lower trunk, then smooth and white, grey or brown above, often in patches. Adult leaves narrowly to broadly lanceolate, acute to acuminate; lamina 7-14 cm long, 1-2 cm wide, green, grey-green or dull green; lateral veins clearly visible, at 25°–35°; intramarginal vein up to 1 mm from margin; petiole terete, 5-15 mm long. Peduncle angular, 5-16 mm long; pedicels angular, 3-9 mm long. Operculum conical, 2-4 mm long, 3-4 mm wide; hypanthium obconical to obovoid, approx 4 mm long, 3-4 mm wide. Fruits hemispherical to ovoid, 4-9 mm long, 4-7 mm wide; disc descending; valves 4 or 5, level or included. Gum-barked. Coolibah. Fig. 101E–F","Flora of Australia Volume 19, Myrtaceae, Eucalyptus, Angophora, Australian Government Publishing Service, Canberra (1988)"
2684,128.3947222222222,-26.102222222222224,213,148,46,6059,370,51,319,285,148,285,131,226,28,9,34,81,32,81,39,Eucalyptus sparsa,2000,Eucalyptus,Symphyomyrtus,Adnataria,Buxeales,Subplatyphyllae,sparsa,NA,Eucalyptus sparsa,NA,NA,mallee,NA,15,50,4,4,6000,35,120,6,5,6000,25,85,5,4.5,"Mallee, sometimes a tree, to 6 m. Bark rough, fibrous, grey or grey-brown on lower trunk, then smooth, grey above. Juvenile leaves not seen. Adult leaves lanceolate to broadly lanceolate or ovate, acute; lamina 5-12 cm long, 1.5-3.5 cm wide, shining, green; lateral veins prominent, at 25°–40°; intramarginal vein up to 4 mm from margin; petiole terete, 15-25 mm long. Conflorescence terminal, paniculate, sometimes axillary, simple; umbels 7-flowered; peduncle terete, 6-11 mm long; pedicels 2-3 mm long. Buds ovoid to clavate; operculum hemispherical to conical, 2-3 mm long, 3-4 mm wide; hypanthium obovoid, 3-4 mm long and wide. Fruits hemispherical to subglobular, 4-5 mm long, 4-6 mm wide; disc broad, descending; valves 4-6, level or included. Fig. 103K–L","Flora of Australia Volume 19, Myrtaceae, Eucalyptus, Angophora, Australian Government Publishing Service, Canberra (1988)"
2761,118.86722222222221,-28.96388888888889,198,142,45,6186,363,50,313,128,192,277,118,252,36,10,35,95,35,57,85,Eucalyptus petraea,2000,Eucalyptus,Symphyomyrtus,Adnataria,Lucasianae,NA,petraea,NA,Eucalyptus petraea,NA,NA,tree,NA,20,70,6,5,14000,25,120,7,8,14000,22.5,95,6.5,6.5,"Tree or mallee to 14 m. Bark rough, fibrous, dark grey on trunk for 3-10 m, then smooth, grey to pink-grey above, deciduous in long ribbons. Juvenile leaves not seen. Adult leaves lanceolate, acute to acuminate; lamina 7-12 cm long, 2-2.5 cm wide, shining, dark green; lateral veins usually distinct, at 30°–40°; intramarginal vein up to 2 mm from margin; petiole terete, 15-25 mm long. Peduncle angular, 13-18 mm long; pedicels 3-7 mm long. Buds obconical; operculum conical, 2-4 mm long, 4-5 mm wide; hypanthium obconical, 3-5 mm long, 4-5 mm wide. Fruits obconical to obovoid or hemispherical, 5-8 mm long, 6-7 mm wide; valves 4 or 5. Fig. 102E–F","Flora of Australia Volume 19, Myrtaceae, Eucalyptus, Angophora, Australian Government Publishing Service, Canberra (1988)"
2873,141.48527777777775,-36.573888888888895,142,135,52,4281,291,33,258,88,197,197,88,508,65,22,35,179,72,73,179,Eucalyptus molyneuxii,2000,Eucalyptus,Eucalyptus,Eucalyptus,Radiatae,NA,molyneuxii,NA,NA,NA,NA,NA,NA,NA,NA,NA,NA,NA,NA,NA,NA,NA,NA,NA,NA,NA,NA,NA,NA
2897,144.13861111111112,-35.615,161,131,47,5080,312,38,274,128,226,226,96,397,43,21,20,122,76,76,110,Eucalyptus leucoxylon subsp. pruinosa,2000,Eucalyptus,Symphyomyrtus,Adnataria,Melliodorae,NA,leucoxylon,pruinosa,NA,NA,NA,NA,NA,NA,NA,NA,NA,NA,NA,NA,NA,NA,NA,NA,NA,NA,NA,NA,NA
2898,147.20027777777776,-35.10583333333334,158,130,44,5663,317,28,289,119,229,231,86,550,57,34,15,160,116,118,148,Eucalyptus albens,2000,Eucalyptus,Symphyomyrtus,Adnataria,Subbuxeales,NA,albens,NA,Eucalyptus albens,NA,NA,tree,NA,17,100,5,6,25000,30,160,10,15,25000,23.5,130,7.5,10.5,"Tree to 25 m. Bark rough, fibrous, light grey or somewhat bleached on trunk, then smooth and white above. Juvenile leaves ovate to suborbicular, sometimes cordate, 9-15 cm long, 6-11.5 cm wide, grey-green to blue-green. Adult leaves broadly lanceolate to lanceolate, acuminate; lamina 10-16 cm long, 1.7-3 cm wide, glaucous or grey-green; lateral veins prominent, at 20°–30°; intramarginal vein up to 2 mm from margin; petiole terete to slightly flattened, 15-22 mm long. Peduncle quadrangular, glaucous, 10-15 mm long; pedicels absent or 1-5 mm long. Buds cylindrical, glaucous; operculum conical, 4-8 mm long, 4-7 mm wide; hypanthium cylindrical, 4-8 mm long, 4-7 mm wide. Fruits cylindrical to suburceolate, glaucous, often ribbed, 6-15 mm long, 5-10 mm wide. White. Box. Fig. 102 I–J","Flora of Australia Volume 19, Myrtaceae, Eucalyptus, Angophora, Australian Government Publishing Service, Canberra (1988)"
2899,147.93944444444446,-35.26583333333333,146,139,47,5530,309,14,295,86,216,218,76,797,87,40,21,247,152,153,237,Eucalyptus polyanthemos subsp. polyanthemos,2000,Eucalyptus,Symphyomyrtus,Adnataria,Heterophloiae,NA,polyanthemos,polyanthemos,NA,NA,NA,NA,NA,NA,NA,NA,NA,NA,NA,NA,NA,NA,NA,NA,NA,NA,NA,NA,NA
2900,149.66,-36.10638888888889,140,118,49,4201,259,21,238,174,93,192,84,902,110,42,25,282,145,248,173,Eucalyptus stenostoma,2000,Eucalyptus,Eucalyptus,Eucalyptus,Stenostomae,NA,stenostoma,NA,Eucalyptus stenostoma,NA,NA,tree,NA,15,130,NA,9,25000,30,190,NA,10,25000,22.5,160,NA,9.5,"Tree to 25 m, often leaning; stems glaucous. Bark fibrous, fissured, dark grey to black to 4 m, then smooth above, white or yellow-white, with insect ‘scribbles’. Juvenile leaves broadly lanceolate, blue-green. Adult leaves lanceolate, acuminate; lamina 13-19 cm long, 1.5-3 cm wide, green; lateral veins clearly visible, at 10°–15°; intramarginal vein up to 3 mm from margin; petiole terete, 25-35 mm long. Umbels more than 20-flowered; peduncle flattened, 16-28 mm long, often recurved in fruit; pedicels slender, 6-10 mm long. Buds glaucous; operculum hemispherical or conical, 1-2 mm long, 2-3 mm wide; hypanthium obconical, 3-4 mm long, 2-3 mm wide. Fruits globular, 9-10 mm long and wide, with narrow orifice, usually glaucous; disc vertical, descending; valves 3-5, included. Seeds black. Jillaga. Ash. Fig. 60Q–R","Flora of Australia Volume 19, Myrtaceae, Eucalyptus, Angophora, Australian Government Publishing Service, Canberra (1988)"
2902,149.79722222222222,-36.17833333333333,146,106,49,3869,252,37,215,179,102,194,95,985,121,44,25,313,157,303,194,Eucalyptus bosistoana,2000,Eucalyptus,Symphyomyrtus,Adnataria,Melliodorae,NA,bosistoana,NA,Eucalyptus bosistoana,NA,NA,tree,NA,7,100,NA,4,60000,20,200,NA,7,60000,13.5,150,NA,5.5,"Tree to 60 m. Bark rough, finely fibrous, grey on lower trunk or sometimes higher, or sometimes ±smooth, grey-white throughout. Juvenile leaves ovate to orbicular, green, discolorous. Adult leaves lanceolate to narrowly lanceolate, sometimes falcate, acuminate; lamina 10-20 cm long, 0.7-2 cm wide, green; lateral veins clearly visible, at 25°–45°; intramarginal vein up to 3 mm from margin; petiole terete, 10-17 mm long. Conflorescence usually axillary, simple, sometimes terminal, paniculate; umbels 7-flowered; peduncle terete to quadrangular, 7-10 mm long; pedicels 3-10 mm long. Buds ovoid or clavate; operculum conical to hemispherical, 3-5 mm long and wide; hypanthium hemispherical, approx 4 mm long, 3-5 mm wide. Fruits hemispherical to ovoid, 4-7 mm long and wide; disc moderately broad, descending; valves 5-7, level or included. Bosisto’s Box, Coast. Grey Box. Fig. 103G–H","Flora of Australia Volume 19, Myrtaceae, Eucalyptus, Angophora, Australian Government Publishing Service, Canberra (1988)"
2903,150.14916666666667,-35.76916666666666,158,92,48,3488,246,58,188,189,117,201,112,1079,124,59,23,335,182,327,236,Eucalyptus paniculata,2000,Eucalyptus,Symphyomyrtus,Adnataria,Rhodoxyla,Discolores,paniculata,NA,Eucalyptus paniculata,NA,NA,tree,NA,12,95,5,6,50000,24,150,8,8,50000,18,122.5,6.5,7,"Tree to 50 m. Bark rough throughout, light grey. Juvenile leaves ovate to broadly lanceolate, green, discolorous. Adult leaves lanceolate, acuminate; lamina 9.5-15 cm long, 1.2-2.4 cm wide, green, discolorous; lateral veins clearly visible, at 35°–45°; intramarginal vein up to 1 mm from margin; petiole 13-22 mm long. Peduncle terete, quadrangular or flattened, 6-16 mm long; pedicels 4-angled, 2-10 mm long. Buds obovoid to fusiform; operculum conical, usually narrower than hypanthium, 3-4 mm long and wide; hypanthium obovoid to obconical, 4-5 mm long and wide. Fruits hemispherical, obconical, obovoid or subpyriform, 6-8 mm long, 5-8 mm wide; disc obscure, descending; valves 4 or 5, level or included. Seeds shallowly reticulate. Grey. Ironbark. Fig. 107K–L","Flora of Australia Volume 19, Myrtaceae, Eucalyptus, Angophora, Australian Government Publishing Service, Canberra (1988)"
2904,150.1288888888889,-35.09861111111111,129,115,47,4380,254,12,242,181,79,183,70,974,109,60,17,292,194,267,216,Eucalyptus triflora,2000,Eucalyptus,Eucalyptus,Eucalyptus,Strictae,Irregulares,triflora,NA,Eucalyptus triflora,NA,NA,tree,NA,13,75,7,7,15000,20,130,9,10,15000,16.5,102.5,8,8.5,"Tree to 15 m. Bark smooth throughout, grey or white, sometimes mottled with yellow or orange-yellow, usually with insect ‘scribbles’. Juvenile leaves broadly lanceolate, shining, green, slightly discolorous. Adult leaves lanceolate, falcate, acuminate, oblique, thick; lamina 7.5-13 cm long, 1.3-2 cm wide, shining, green, concolorous; lateral veins faint, at 15°–25°; intramarginal vein 1-2 mm from margin; petiole thick, flattened or channelled, 8-15 mm long. Umbels 3-flowered, rarely 7-flowered; peduncle flattened, 3-6 mm long; pedicels absent. Buds cylindrical-clavate, angled due to crowding; operculum hemispherical or conical, 2-3 mm long, 3-5 mm wide; hypanthium cylindrical or hemispherical, 3-4 mm long, 3-5 mm wide, warty. Fruits usually subglobular or suburceolate, sometimes hemispherical, 7-10 mm long, 7-9 mm wide; disc narrow to moderately broad, level or descending; valves 4 or 5, included. Seeds brown. Pigeon. House. Ash. Fig. 61A–B","Flora of Australia Volume 19, Myrtaceae, Eucalyptus, Angophora, Australian Government Publishing Service, Canberra (1988)"
2910,151.2563888888889,-33.65694444444444,170,97,48,3790,261,60,201,214,126,215,119,1295,158,66,28,448,213,380,284,Eucalyptus luehmanniana,2000,Eucalyptus,Eucalyptus,Eucalyptus,Fraxinales,NA,luehmanniana,NA,Eucalyptus luehmanniana,NA,NA,mallee,NA,20,150,7,10,6000,40,180,10,13,6000,30,165,8.5,11.5,"Mallee to 6 m. Bark smooth, white throughout. Juvenile leaves oblong or elliptic, shining, green. Adult leaves lanceolate, acuminate or mucronate, leathery; lamina 15-18 cm long, 2-4 cm wide, shining green; lateral veins just visible, at 20°–40°; intramarginal vein up to 2 mm from margin; petiole flattened, 15-25 mm long. Umbels 7-11-flowered; peduncle flattened, broad, 10-25 mm long; pedicels flattened, 4-8 mm long. Buds fusiform, sometimes glaucous; operculum conical, ribbed, 4-6 mm long and wide; hypanthium conical, ribbed, 5-7 mm long, 4-6 mm wide. Fruits hemispherical, ribbed, 10-13 mm long, 7-10 mm wide; disc flat or convex; valves 5, included. Seeds black. Yellow-top. Mallee. Ash. Fig. 59C–D","Flora of Australia Volume 19, Myrtaceae, Eucalyptus, Angophora, Australian Government Publishing Service, Canberra (1988)"
