1703,129.87472222222223,-27.03888888888889,196,157,48,5883,358,33,325,267,133,267,117,245,30,11,29,85,37,85,41,Eucalyptus gillenii,1997,Eucalyptus,Symphyomyrtus,Exsertaria,Exsertae,Exsertae,gillenii,NA,Eucalyptus gillenii,NA,NA,mallee,NA,12,100,6,6,3000,25,150,12,15,3000,18.5,125,9,10.5,"Mallee to 3 m or tree to 6 m. Bark smooth throughout, white, grey or pale brown. Juvenile leaves narrowly to broadly lanceolate, grey-green, concolorous. Adult leaves lanceolate, sometimes falcate, acute to acuminate, thick; lamina 10-15 cm long, 1.2-2.5 cm wide, green; lateral veins at 40°–45°; intramarginal vein up to 1 mm from margin; petiole flattened or angular, 15-30 mm long. Umbels 7-flowered, occasionally 3-flowered, single or paired; peduncle thick, terete, 5-10 mm long; pedicels absent or to 4 mm long. Buds ovoid to obovoid or ±conical; operculum conical, 4-8 mm long, 3-6 mm wide; hypanthium hemispherical, 3-4 mm long, 3-6 mm wide. Fruits subglobular to ovoid, 6-15 mm long, 6-12 mm wide; disc broad, steeply ascending; valves 3-5, strongly exserted. Seeds brown-black. Fig. 92 I–J","Flora of Australia Volume 19, Myrtaceae, Eucalyptus, Angophora, Australian Government Publishing Service, Canberra (1988)"
1716,139.73194444444445,-36.281666666666666,152,108,53,3348,268,66,202,109,194,194,109,523,75,16,46,211,57,57,211,Eucalyptus fasciculosa,1997,Eucalyptus,Symphyomyrtus,Adnataria,Heterophloiae,NA,fasciculosa,NA,Eucalyptus fasciculosa,NA,NA,tree,NA,15,80,5,6,15000,35,130,6,9,15000,25,105,5.5,7.5,"Tree to 15 m. Bark flaky on a variable amount of trunk, brown to grey, then smooth, grey-yellow to white-grey above. Juvenile leaves ovate, green, concolorous. Adult leaves lanceolate to broadly lanceolate, acute, oblique; lamina 8-13 cm long, 1.5-3.5 cm wide, dull, or sometimes almost shining, green; lateral veins faint or just visible, at 40°–50°; intramarginal vein 1-2 mm from margin; petiole terete, 15-20 mm long. Conflorescence terminal, paniculate; peduncle quadrangular, 5-10 mm long; pedicels 1-4 mm long. Buds clavate to fusiform; operculum conical, 2-3 mm long, approx 3 mm wide; hypanthium obovoid, 3-4 mm long and wide. Fruits obconical to obovoid, 6-9 mm long, 5-6 mm wide; disc narrow. Pink. Gum. Fig. 107C–D","Flora of Australia Volume 19, Myrtaceae, Eucalyptus, Angophora, Australian Government Publishing Service, Canberra (1988)"
1720,141.44222222222223,-38.23861111111111,133,87,52,2753,226,59,167,98,166,169,98,833,111,23,40,321,104,108,321,Eucalyptus kitsoniana,1997,Eucalyptus,Symphyomyrtus,Maidenaria,Viminales,Lanceolatae,kitsoniana,NA,Eucalyptus kitsoniana,NA,NA,mallee,NA,NA,120,NA,7,9000,25,180,NA,8,9000,25,150,NA,7.5,"Mallee to 9 m. Bark smooth throughout, white to grey, sometimes with accumulated decorticating bark at trunk base. Juvenile leaves opposite, sessile, ovate to suborbicular, emarginate, often mucronate, green, discolorous. Adult leaves alternate, lanceolate to broadly lanceolate, sometimes falcate, acuminate; lamina 12-18 cm long, approx 2.5 cm wide, green, concolorous; lateral veins at 25°–35°; intramarginal vein up to 2 mm from margin; petiole flattened, 10-15 mm long. Umbels 7-flowered; peduncle flattened, 7-25 mm long; pedicels absent. Buds ovoid to fusiform; operculum conical, 3-4 mm long, 5-7 mm wide; hypanthium hemispherical, 3-4 mm long, 5-7 mm wide. Fruits hemispherical to cylindrical, ±wrinkled, 7-8 mm long and wide; disc moderately broad, level to slightly ascending; valves 3 or 4, ±level. Gippsland. Mallee. Fig. 94C–D","Flora of Australia Volume 19, Myrtaceae, Eucalyptus, Angophora, Australian Government Publishing Service, Canberra (1988)"
1722,141.45388888888888,-38.23527777777778,133,87,52,2753,226,59,167,98,166,169,98,833,111,23,40,321,104,108,321,Eucalyptus splendens,1997,Eucalyptus,Symphyomyrtus,Maidenaria,Viminales,Lanceolatae,splendens,NA,NA,NA,NA,NA,NA,NA,NA,NA,NA,NA,NA,NA,NA,NA,NA,NA,NA,NA,NA,NA,NA
1724,143.2525,-38.74111111111111,131,82,49,2964,226,59,167,94,171,171,94,1143,145,45,33,403,157,157,403,Eucalyptus viminalis subsp. viminalis,1997,Eucalyptus,Symphyomyrtus,Maidenaria,Viminales,Lanceolatae,viminalis,viminalis,NA,NA,NA,NA,NA,NA,NA,NA,NA,NA,NA,NA,NA,NA,NA,NA,NA,NA,NA,NA,NA
1725,143.2513888888889,-38.73583333333333,131,82,49,2964,226,59,167,94,171,171,94,1143,145,45,33,403,157,157,403,Eucalyptus strzeleckii,1997,Eucalyptus,Symphyomyrtus,Maidenaria,Foveolatae,NA,strzeleckii,NA,NA,NA,NA,NA,NA,NA,NA,NA,NA,NA,NA,NA,NA,NA,NA,NA,NA,NA,NA,NA,NA
1726,143.8363888888889,-38.68861111111111,133,84,48,3083,230,57,173,98,174,174,94,985,122,42,31,336,141,141,335,Eucalyptus globulus,1997,Eucalyptus,Symphyomyrtus,Maidenaria,Globulares,Euglobulares,globulus,NA,Eucalyptus globulus,NA,NA,tree,NA,NA,NA,NA,NA,45000,NA,NA,NA,NA,45000,NA,NA,NA,NA,"Trees, usually to 45 m, sometimes to 70 m. Bark usually smooth, white to cream, yellow or grey, but accumulated grey-brown, undecorticated bark at the trunk base. Juvenile leaves opposite, sessile, amplexicaul, ovate, grey-green to glaucous, discolorous. Adult leaves lanceolate to narrowly lanceolate, sometimes falcate, acuminate, green, concolorous. Umbels 1-, 3- or 7-flowered; peduncles flattened or terete; pedicels present or absent. Buds turbinate to obconical, warty glaucous; operculum flattened hemispherical, shortly umbonate; hypanthium obconical, ribbed or ±smooth. Fruits obconical to hemispherical or subglobular, glaucous or not; disc broad, level to ascending; valves 3-5, level or exserted","Flora of Australia Volume 19, Myrtaceae, Eucalyptus, Angophora, Australian Government Publishing Service, Canberra (1988)"
1727,144.10999999999999,-38.453611111111115,137,89,48,3230,237,55,182,100,179,179,95,692,79,36,24,220,114,114,213,Eucalyptus tricarpa,1997,Eucalyptus,Symphyomyrtus,Adnataria,Melliodorae,NA,tricarpa,NA,NA,NA,NA,NA,NA,NA,NA,NA,NA,NA,NA,NA,NA,NA,NA,NA,NA,NA,NA,NA,NA
1728,145.19305555555556,-37.87722222222222,144,100,48,3694,260,54,206,118,191,191,96,850,88,50,17,246,158,158,222,Eucalyptus yarraensis,1997,Eucalyptus,Symphyomyrtus,Maidenaria,Foveolatae,NA,yarraensis,NA,Eucalyptus yarraensis,NA,NA,tree,NA,25,60,NA,4,20000,30,100,NA,5,20000,27.5,80,NA,4.5,"Tree to 20 m. Bark rough, fibrous on trunk and usually extending throughout, brown or grey-brown. Juvenile leaves broadly ovate, green, slightly discolorous. Adult leaves elliptic to broadly lanceolate, undulate, acute; lamina 6-10 cm long, 2.5-3 cm wide, green; lateral veins just visible, at 20°–35°; intramarginal vein up to 2 mm from margin; petiole terete, 15-20 mm long. Umbels 7-flowered; peduncle terete or quadrangular, 5-8 mm long; pedicels 2-4 mm long. Buds ovoid; operculum conical, 2-3 mm long and wide; hypanthium obconical, c. 2 mm long, 2-3 mm wide. Fruits obconical to hemispherical, 4-5 mm long and wide; disc narrow, level; valves 3 or 4, slightly exserted. Yarra. Gum. Fig. 92 O–P","Flora of Australia Volume 19, Myrtaceae, Eucalyptus, Angophora, Australian Government Publishing Service, Canberra (1988)"
1729,145.6497222222222,-38.07166666666667,139,104,48,3647,259,45,214,114,186,186,92,944,99,50,20,291,166,166,252,Eucalyptus fulgens,1997,Eucalyptus,Symphyomyrtus,Maidenaria,Viminales,Lanceolatae,fulgens,NA,NA,NA,NA,NA,NA,NA,NA,NA,NA,NA,NA,NA,NA,NA,NA,NA,NA,NA,NA,NA,NA
1731,145.78722222222223,-38.075,140,107,49,3700,262,44,218,116,188,188,93,960,102,49,21,299,165,165,258,Eucalyptus strzeleckii,1997,Eucalyptus,Symphyomyrtus,Maidenaria,Foveolatae,NA,strzeleckii,NA,NA,NA,NA,NA,NA,NA,NA,NA,NA,NA,NA,NA,NA,NA,NA,NA,NA,NA,NA,NA,NA
1732,147.24555555555554,-37.92222222222222,137,116,52,3662,253,32,221,152,183,183,89,664,71,39,15,201,148,148,148,Eucalyptus globoidea,1997,Eucalyptus,Eucalyptus,Eucalyptus,Pachyphloiae,NA,globoidea,NA,Eucalyptus globoidea,NA,NA,tree,NA,12,75,6,4,30000,25,125,8,7,30000,18.5,100,7,5.5,"Tree to 30 m. Bark grey. Juvenile leaves ovate, undulate, green, discolorous. Adult leaves lanceolate to broadly lanceolate, acuminate; lamina 7.5-12.5 cm long, 1.2-2.5 cm wide, green, shining, concolorous; lateral veins just visible, at 20°–40°; intramarginal vein up to 2 mm from margin; petiole channelled, 7-17 mm long. Umbels 7-11-flowered or sometimes more; peduncle angular or flattened, 4-12 mm long; pedicels absent or to 2 mm long. Buds fusiform; operculum conical, 3-4 mm long and wide; hypanthium obconical, 2-3 mm long, 3-4 mm wide. Fruits hemispherical or subglobular, 4-7 mm long, 6-8 mm wide; disc broad, level or convex; valves 4, ±level. White. Stringybark. Fig. 57 I–J","Flora of Australia Volume 19, Myrtaceae, Eucalyptus, Angophora, Australian Government Publishing Service, Canberra (1988)"
1733,147.85416666666666,-37.87777777777778,144,104,52,3337,246,47,199,156,186,186,100,722,74,36,16,212,145,145,177,Eucalyptus bosistoana,1997,Eucalyptus,Symphyomyrtus,Adnataria,Melliodorae,NA,bosistoana,NA,Eucalyptus bosistoana,NA,NA,tree,NA,7,100,NA,4,60000,20,200,NA,7,60000,13.5,150,NA,5.5,"Tree to 60 m. Bark rough, finely fibrous, grey on lower trunk or sometimes higher, or sometimes ±smooth, grey-white throughout. Juvenile leaves ovate to orbicular, green, discolorous. Adult leaves lanceolate to narrowly lanceolate, sometimes falcate, acuminate; lamina 10-20 cm long, 0.7-2 cm wide, green; lateral veins clearly visible, at 25°–45°; intramarginal vein up to 3 mm from margin; petiole terete, 10-17 mm long. Conflorescence usually axillary, simple, sometimes terminal, paniculate; umbels 7-flowered; peduncle terete to quadrangular, 7-10 mm long; pedicels 3-10 mm long. Buds ovoid or clavate; operculum conical to hemispherical, 3-5 mm long and wide; hypanthium hemispherical, approx 4 mm long, 3-5 mm wide. Fruits hemispherical to ovoid, 4-7 mm long and wide; disc moderately broad, descending; valves 5-7, level or included. Bosisto’s Box, Coast. Grey Box. Fig. 103G–H","Flora of Australia Volume 19, Myrtaceae, Eucalyptus, Angophora, Australian Government Publishing Service, Canberra (1988)"
1734,147.85416666666666,-37.87777777777778,144,104,52,3337,246,47,199,156,186,186,100,722,74,36,16,212,145,145,177,Eucalyptus baueriana,1997,Eucalyptus,Symphyomyrtus,Adnataria,Heterophloiae,NA,baueriana,NA,Eucalyptus baueriana,NA,NA,tree,NA,30,60,4,5,20000,50,100,6,7,20000,40,80,5,6,"Tree to 20 m. Bark fibrous, flaky, light grey on trunk and larger branches, then smooth, grey to white above. Juvenile leaves suborbicular, emarginate, dull, grey-green, concolorous. Juvenile or ovate intermediate leaves often persist on mature trees. Adult leaves ovate to broadly lanceolate, acuminate; lamina 6-10 cm long, 3-5 cm wide, glaucous or green; lateral veins clearly visible, at 30°–40°; intramarginal vein up to 4 mm from margin; petiole terete, 20-25 mm long. Conflorescence terminal, paniculate; peduncle terete, 5-10 mm long; pedicels 2-4 mm long. Buds clavate or fusiform, glaucous; operculum conical, 1-2 mm long, 2-3 mm wide, usually narrower than hypanthium; hypanthium ovoid to obconical, 3-4 mm long, approx 3 mm wide. Fruits obconical, 5-7 mm long, 4-6 mm wide; disc broad. Blue. Box. Fig. 106K–L","Flora of Australia Volume 19, Myrtaceae, Eucalyptus, Angophora, Australian Government Publishing Service, Canberra (1988)"
1735,147.85416666666666,-37.87777777777778,144,104,52,3337,246,47,199,156,186,186,100,722,74,36,16,212,145,145,177,Eucalyptus pseudoglobulus,1997,Eucalyptus,Symphyomyrtus,Maidenaria,Globulares,Euglobulares,pseudoglobulus,NA,NA,NA,NA,NA,NA,NA,NA,NA,NA,NA,NA,NA,NA,NA,NA,NA,NA,NA,NA,NA,NA
1736,147.85222222222222,-37.84444444444445,144,105,52,3374,247,46,201,156,186,186,99,735,76,37,16,218,148,148,179,Eucalyptus tereticornis subsp. mediana,1997,Eucalyptus,Symphyomyrtus,Exsertaria,Exsertae,Erythroxyla,tereticornis,mediana,NA,NA,NA,NA,NA,NA,NA,NA,NA,NA,NA,NA,NA,NA,NA,NA,NA,NA,NA,NA,NA
1737,147.98527777777775,-37.71027777777778,138,107,51,3474,246,39,207,152,182,182,93,802,84,44,15,238,165,165,192,Eucalyptus mackintii,1997,Eucalyptus,Eucalyptus,Eucalyptus,Pachyphloiae,NA,mackintii,NA,NA,NA,NA,NA,NA,NA,NA,NA,NA,NA,NA,NA,NA,NA,NA,NA,NA,NA,NA,NA,NA
1740,148.60777777777778,-37.80083333333333,146,99,50,3340,247,52,195,110,189,189,103,909,93,54,15,265,178,178,245,Eucalyptus viminalis subsp. pryoriana,1997,Eucalyptus,Symphyomyrtus,Maidenaria,Viminales,Lanceolatae,viminalis,pryoriana,NA,NA,NA,NA,NA,NA,NA,NA,NA,NA,NA,NA,NA,NA,NA,NA,NA,NA,NA,NA,NA
1741,148.73194444444445,-37.78638888888889,145,97,50,3331,245,52,193,109,188,188,102,943,97,56,15,276,184,184,259,Eucalyptus ovata subsp. ovata,1997,Eucalyptus,Symphyomyrtus,Maidenaria,Foveolatae,NA,ovata,ovata,NA,NA,NA,NA,NA,NA,NA,NA,NA,NA,NA,NA,NA,NA,NA,NA,NA,NA,NA,NA,NA
1742,148.9013888888889,-37.409166666666664,133,106,49,3751,244,31,213,148,180,180,84,942,98,65,14,264,197,197,251,Eucalyptus elata,1997,Eucalyptus,Eucalyptus,Eucalyptus,Radiatae,NA,elata,NA,Eucalyptus elata,NA,NA,tree,NA,7,100,NA,4,30000,13,140,NA,6,30000,10,120,NA,5,"Tree to 30 m. Bark fibrous to approx 10 m, compact, dark grey, with longitudinal fissures, then smooth, grey or white above. Juvenile leaves lanceolate, amplexicaul, green. Adult leaves narrowly lanceolate, acuminate, thin; lamina 10-14 cm long, 0.7-1.3 cm wide, green; lateral veins faint, at 15°–25°; intramarginal vein up to 1 mm from margin; petiole terete, 10-15 mm long. Umbels up to 40-flowered; peduncle angular, 5-10 mm long; pedicels 2-5 mm long. Operculum hemispherical or conical, approx 1 mm long, 1-2 mm wide; hypanthium obconical or subpyriform, 2-3 mm long and wide. Fruits subglobular, 4-6 mm long and wide; disc broad, descending or level; valves 3 or 4, included. River. Peppermint. Fig. 63K–L","Flora of Australia Volume 19, Myrtaceae, Eucalyptus, Angophora, Australian Government Publishing Service, Canberra (1988)"
1743,148.84722222222223,-37.34,95,106,48,3993,213,-7,220,90,145,145,43,968,100,65,12,272,211,211,249,Eucalyptus denticulata,1997,Eucalyptus,Symphyomyrtus,Maidenaria,'Remanentes' ms,NA,denticulata,NA,NA,NA,NA,NA,NA,NA,NA,NA,NA,NA,NA,NA,NA,NA,NA,NA,NA,NA,NA,NA,NA
1744,149.07777777777778,-37.565555555555555,143,94,48,3442,243,50,193,105,186,186,97,1018,104,66,14,290,205,205,281,Eucalyptus croajingolensis,1997,Eucalyptus,Eucalyptus,Eucalyptus,Radiatae,NA,croajingolensis,NA,NA,NA,NA,NA,NA,NA,NA,NA,NA,NA,NA,NA,NA,NA,NA,NA,NA,NA,NA,NA,NA
1745,149.57666666666665,-37.48222222222223,147,78,46,3185,233,64,169,133,188,188,105,929,98,63,12,257,202,202,244,Eucalyptus angophoroides,1997,Eucalyptus,Symphyomyrtus,Maidenaria,Bridgesianae,NA,angophoroides,NA,Eucalyptus angophoroides,NA,NA,tree,NA,18,110,6,4,40000,25,200,7,5,40000,21.5,155,6.5,4.5,"Tree to 40 m. Bark rough, flaky or fibrous, grey to grey-brown on trunk and larger branches or throughout, sometimes smooth above. Juvenile leaves opposite to subopposite, sessile to shortly petiolate, broadly ovate to suborbicular, amplexicaul, cordate, crenulate, discolorous. Adult leaves alternate, lanceolate to narrowly lanceolate, acuminate; lamina 11-20 cm long, 1.8-2.5 cm wide, green, discolorous; lateral veins faint or visible, at 35°–45°; intramarginal vein up to 2 mm from margin; petiole terete, 15-27 mm long. Umbels 7-flowered; peduncle slightly flattened, 5-10 mm long; pedicels 1-6 mm long. Buds ovoid; operculum conical or hemispherical, apiculate, 4-5 mm long, 5-6 mm wide; hypanthium hemispherical, 3-4 mm long, 5-6 mm wide. Fruits obconical or hemispherical, 4-5 mm long, 6-7 mm wide; disc moderately broad, level or slightly ascending; valves usually 4, exserted. Apple-topped. Box. Fig. 94K–L","Flora of Australia Volume 19, Myrtaceae, Eucalyptus, Angophora, Australian Government Publishing Service, Canberra (1988)"
1751,149.9052777777778,-36.65888888888889,148,99,48,3666,247,43,204,180,106,193,99,954,110,51,22,299,164,282,197,Eucalyptus spectatrix,1997,Eucalyptus,Eucalyptus,Eucalyptus,Strictae,Irregulares,spectatrix,NA,NA,NA,NA,NA,NA,NA,NA,NA,NA,NA,NA,NA,NA,NA,NA,NA,NA,NA,NA,NA,NA
1753,149.98416666666665,-35.54805555555556,141,112,48,4144,257,26,231,191,94,192,86,941,107,55,20,284,171,252,201,Eucalyptus muelleriana,1997,Eucalyptus,Eucalyptus,Eucalyptus,Pachyphloiae,NA,muelleriana,NA,Eucalyptus muelleriana,NA,NA,tree,NA,15,80,8,7,40000,25,130,12,10,40000,20,105,10,8.5,"Tree to 40 m. Bark thick, grey-brown. Juvenile leaves ovate, often oblique, green, discolorous. Adult leaves broadly lanceolate to lanceolate, acuminate; lamina 8-13 cm long, 1.5-2.5 cm wide, green, discolorous; lateral veins prominent, at 20°–35°; intramarginal vein faint, 1-2 mm from margin; petiole channelled, 15-20 mm long. Umbels 7-11-flowered; peduncle angular or flattened, 8-18 mm long; pedicels 1-3 mm long. Buds ovoid to clavate; operculum hemispherical to conical, 2-3 mm long, 3-4 mm wide; hypanthium obconical, 3-5 mm long, 3-4 mm wide. Fruits subglobular to truncate-ovoid, 7-10 mm long, 8-12 mm wide; disc broad, level or slightly descending or sometimes slightly convex; valves 4, slightly included or slightly exserted. Yellow. Stringybark. Fig. 55K–L","Flora of Australia Volume 19, Myrtaceae, Eucalyptus, Angophora, Australian Government Publishing Service, Canberra (1988)"
1754,149.98416666666665,-35.54805555555556,141,112,48,4144,257,26,231,191,94,192,86,941,107,55,20,284,171,252,201,Eucalyptus agglomerata,1997,Eucalyptus,Eucalyptus,Eucalyptus,Pachyphloiae,NA,agglomerata,NA,Eucalyptus agglomerata,NA,NA,tree,NA,14,75,5,4,40000,30,120,10,6,40000,22,97.5,7.5,5,"Tree to 40 m. Bark grey. Juvenile leaves ovate, green, slightly discolorous to concolorous. Adult leaves lanceolate to broadly lanceolate, acuminate; lamina 7.5-12 cm long, 1.4-3 cm wide, green or blue-green, concolorous; lateral veins clearly visible, at 25°–35°; intramarginal vein up to 3 mm from margin; petiole flattened or channelled, 13-18 mm long. Umbels 11-15-flowered or more; peduncle angular or flattened, 6-13 mm long; pedicels absent. Buds fusiform; operculum conical, 4-5 mm long, 3 mm wide; hypanthium obconical, 3 mm long and wide. Fruits hemispherical or subglobular, angular, 4-6 mm long, 5-10 mm wide; disc broad, flat or convex; valves 3 or 4, ±level. Blue-leaved. Stringybark. Fig. 56Q–R","Flora of Australia Volume 19, Myrtaceae, Eucalyptus, Angophora, Australian Government Publishing Service, Canberra (1988)"
1756,150.0338888888889,-35.2675,127,119,47,4486,257,8,249,181,77,183,68,849,91,53,15,247,173,227,187,Eucalyptus gregsoniana,1997,Eucalyptus,Eucalyptus,Eucalyptus,Pauciflorae,NA,gregsoniana,NA,Eucalyptus gregsoniana,NA,NA,mallee,NA,15,70,NA,6,5000,25,110,NA,8,5000,20,90,NA,7,"Mallee to 5 m. Bark smooth, white to light grey throughout. Juvenile leaves lanceolate, blue-green. Adult leaves lanceolate, acuminate, symmetrical or slightly oblique, thick; lamina 7-11 cm long, 1.5-2.5 cm wide, grey-green; lateral veins distinct, almost parallel to midrib; intramarginal vein up to 1 mm from margin; petiole thick, flattened or channelled, 8-12 mm long. Umbels 7-11-flowered; peduncle absent, or terete, up to 10 mm long; pedicels absent or up to 2 mm long. Buds clavate; operculum hemispherical or conical, 2-3 mm long, approx 4 mm wide; hypanthium obconical, 5-6 mm long, approx 4 mm wide. Fruits truncate-pyriform, sometimes wrinkled, 6-8 mm long and wide; disc level or convex; valves 3, just included. Seeds black. Mallee. Snow Gum. Fig. 59K–L","Flora of Australia Volume 19, Myrtaceae, Eucalyptus, Angophora, Australian Government Publishing Service, Canberra (1988)"
1757,150.35194444444443,-35.014722222222225,145,104,48,3948,253,37,216,177,100,194,92,1208,142,65,23,380,214,329,266,Eucalyptus sturgissiana,1997,Eucalyptus,Symphyomyrtus,Maidenaria,Sturgissianae,NA,sturgissiana,NA,Eucalyptus sturgissiana,NA,NA,mallee,NA,7,75,NA,4,5000,15,120,NA,6,5000,11,97.5,NA,5,"Mallee to 5 m. Bark smooth throughout, grey to grey-brown or pink. Juvenile leaves opposite, sessile, connate, elliptic to orbicular or ovate, glaucous, discolorous. Adult leaves alternate or subopposite, lanceolate to narrowly lanceolate, acuminate; lamina 7.5-12 cm long, 0.7-1.5 cm wide, light green or grey-green, concolorous; lateral veins faint, at 25°–40°; intramarginal vein up to 1 mm from margin; petiole flattened, 2-7 mm long. Umbels 7-flowered; peduncle flattened, 5-10 mm long; pedicels absent or extremely short. Buds fusiform, often glaucous; operculum conical or hemispherical, apiculate, 2-3 mm long, 3-4 mm wide; hypanthium obconical, 3-4 mm long and wide. Fruits hemispherical to cylindrical, 4-6 mm long and wide; disc narrow, slightly convex, then descending; valves 3 or 4, level. Ettrema. Mallee. Fig. 94E–F","Flora of Australia Volume 19, Myrtaceae, Eucalyptus, Angophora, Australian Government Publishing Service, Canberra (1988)"
1763,150.55027777777778,-34.217222222222226,152,120,49,4252,267,24,243,201,103,203,94,1028,127,45,29,354,157,319,208,Eucalyptus parramattensis subsp. parramattensis,1997,Eucalyptus,Symphyomyrtus,Exsertaria,'Liberivalvae' ms,NA,parramattensis,parramattensis,NA,NA,NA,NA,NA,NA,NA,NA,NA,NA,NA,NA,NA,NA,NA,NA,NA,NA,NA,NA,NA
1764,149.80972222222223,-35.572500000000005,123,122,48,4535,254,2,252,178,73,180,63,1001,117,59,19,303,195,264,225,Eucalyptus maidenii,1997,Eucalyptus,Symphyomyrtus,Maidenaria,Globulares,Euglobulares,maidenii,NA,NA,NA,NA,NA,NA,NA,NA,NA,NA,NA,NA,NA,NA,NA,NA,NA,NA,NA,NA,NA,NA
1765,149.76555555555555,-35.60388888888889,143,119,48,4344,265,22,243,178,94,196,85,879,104,50,21,270,158,235,182,Eucalyptus kartzoffiana,1997,Eucalyptus,Symphyomyrtus,Maidenaria,Viminales,Lanceolatae,kartzoffiana,NA,Eucalyptus kartzoffiana,NA,NA,tree,NA,10,80,NA,5,30000,20,200,NA,7,30000,15,140,NA,6,"Tree to 30 m. Bark rough, scaly, light grey-brown on trunk to 4 m, then smooth and white to grey above. Juvenile leaves opposite, sessile, ovate, cordate, glaucous, discolorous. Adult leaves alternate, narrowly lanceolate to lanceolate, acuminate; lamina 8-20 cm long, 1-2 cm wide, dull, green or blue-green, concolorous; lateral veins faint, at 35°–45°; intramarginal vein up to 1 mm from margin; petiole flattened, 17-30 mm long. Umbels 3-flowered; peduncle flattened, broadened upwards, 3-5 mm long; pedicels absent. Buds cylindrical, glaucous; operculum conical, approx 2 mm long, 3-4 mm wide; hypanthium cylindrical, 3-5 mm long, 3-4 mm wide. Fruits campanulate, glaucous, 5-7 mm long and wide; rim flared; disc narrow, slightly ascending; valves 3 or 4, exserted. Araluen. Gum. Fig. 96Y–Z","Flora of Australia Volume 19, Myrtaceae, Eucalyptus, Angophora, Australian Government Publishing Service, Canberra (1988)"
1766,149.55444444444444,-35.987500000000004,95,118,47,4546,227,-21,248,138,44,152,35,1016,96,71,10,274,234,250,235,Eucalyptus nitens,1997,Eucalyptus,Symphyomyrtus,Maidenaria,'Remanentes' ms,NA,nitens,NA,Eucalyptus nitens,NA,NA,tree,NA,15,130,4,4,70000,25,240,6,7,70000,20,185,5,5.5,"Tree to 70 m, occasionally to 90 m. Bark smooth throughout, yellow-white or grey, or sometimes rough, flaky, grey to black at base of trunk. Juvenile leaves opposite, sessile, broadly lanceolate to ovate, amplexicaul, glaucous, discolorous. Adult leaves alternate, lanceolate to narrowly lanceolate, acuminate; lamina 13-24 cm long, 1.5-2.5 cm wide, shining, green, concolorous; lateral veins distinct, at 20°–45°; intramarginal vein up to 3 mm from margin; petiole terete or channelled, 15-22 mm long. Umbels 7-flowered; peduncle slightly flattened, 6-15 mm long; pedicels absent. Buds ovoid to cylindrical, angular or ribbed; operculum conical, 2-3 mm long, 3-4 mm wide; hypanthium cylindrical or angular, 3-4 mm long and wide. Fruits cylindrical or ovoid, often slightly ribbed, shining, 4-7 mm long, 4-6 mm wide; disc narrow, descending; valves 3 or 4, level or slightly exserted. Shining. Gum. Fig. 95C–D","Flora of Australia Volume 19, Myrtaceae, Eucalyptus, Angophora, Australian Government Publishing Service, Canberra (1988)"
1767,149.6575,-36.001666666666665,122,120,49,4369,247,3,244,157,73,176,64,946,103,53,18,276,179,252,197,Eucalyptus badjensis,1997,Eucalyptus,Symphyomyrtus,Maidenaria,Viminales,Lanceolatae,badjensis,NA,Eucalyptus badjensis,NA,NA,tree,NA,7,85,3,3,45000,15,200,6,5,45000,11,142.5,4.5,4,"Tree to 45 m. Bark rough, compact, hard, grey-brown on lower trunk, then smooth and white-green to light brown-grey above. Juvenile leaves opposite, sessile, sometimes amplexicaul, lanceolate, green, slightly discolorous. Adult leaves alternate, narrowly lanceolate, acuminate; lamina 8.5-20 cm long, 0.7-1.5 cm wide, dull, green, concolorous; lateral veins faint, at 25°–40°; intramarginal vein up to 1 mm from margin; petiole terete or slightly flattened, 6-12 mm long. Umbels 3-flowered; peduncle angular, 2-5 mm long; pedicels absent or rarely to 1 mm long. Buds ovoid, sometimes slightly angular; operculum conical, 1-2 mm long, 2-3 mm wide; hypanthium cylindrical to obconical, 2-3 mm long and wide. Fruits obconical or campanulate, with flared rim, 3-5 mm long, 3-6 mm wide; disc moderately broad, convex or ascending; valves 3 or 4, exserted. Big. Badja. Gum. Fig. 96Q–R","Flora of Australia Volume 19, Myrtaceae, Eucalyptus, Angophora, Australian Government Publishing Service, Canberra (1988)"
1771,148.82972222222222,-35.34111111111111,98,124,45,5205,248,-24,272,41,165,165,32,1142,134,67,21,361,217,217,342,Eucalyptus robertsonii,1997,Eucalyptus,Eucalyptus,Eucalyptus,Radiatae,NA,robertsonii,NA,NA,NA,NA,NA,NA,NA,NA,NA,NA,NA,NA,NA,NA,NA,NA,NA,NA,NA,NA,NA,NA
1772,146.23333333333332,-36.40861111111111,141,124,45,5201,295,23,272,84,207,208,75,683,77,34,24,218,122,128,210,Eucalyptus cadens,1997,Eucalyptus,Symphyomyrtus,Maidenaria,Foveolatae,NA,cadens,NA,NA,NA,NA,NA,NA,NA,NA,NA,NA,NA,NA,NA,NA,NA,NA,NA,NA,NA,NA,NA,NA
