unique_ID,Long,Lat,BIO1,BIO2,BIO3,BIO4,BIO5,BIO6,BIO7,BIO8,BIO9,BIO10,BIO11,BIO12,BIO13,BIO14,BIO15,BIO16,BIO17,BIO18,BIO19,species,year,Genus,Subgenus,Section,Series,Subseries,Species,Subspecies,binomen,subsp,variety,habit,height_min_mm,leaf_width_min_mm,leaf_length_min_mm,fruit_width_min_mm,fruit_length_min_mm,height_max_mm,leaf_width_max_mm,leaf_length_max_mm,fruit_width_max_mm,fruit_length_max_mm,mid_mm_height,mid_mm_leaf_width,mid_mm_leaf_length,mid_mm_fruit_width,mid_mm_fruit_length,desc,source
1131,118.73,-34.405833333333334,158,113,56,3217,269,68,201,119,199,199,118,519,66,18,39,181,66,68,178,Eucalyptus rudis subsp. rudis,1995,Eucalyptus,Symphyomyrtus,Exsertaria,Exsertae,Rostratae,rudis,rudis,NA,NA,NA,NA,NA,NA,NA,NA,NA,NA,NA,NA,NA,NA,NA,NA,NA,NA,NA,NA,NA
1146,115.06722222222221,-33.559999999999995,168,95,52,2946,272,91,181,142,206,208,134,833,171,12,81,456,37,43,450,Eucalyptus rudis subsp. cratyantha,1995,Eucalyptus,Symphyomyrtus,Exsertaria,Exsertae,Rostratae,rudis,cratyantha,NA,NA,NA,NA,NA,NA,NA,NA,NA,NA,NA,NA,NA,NA,NA,NA,NA,NA,NA,NA,NA
1154,115.57555555555555,-30.436944444444446,180,127,50,4475,322,72,250,126,237,239,126,597,131,9,81,331,37,41,331,Eucalyptus absita,1995,Eucalyptus,Symphyomyrtus,Adnataria,Lucasianae,NA,absita,NA,NA,NA,NA,NA,NA,NA,NA,NA,NA,NA,NA,NA,NA,NA,NA,NA,NA,NA,NA,NA,NA
1178,113.48805555555556,-24.017777777777777,228,114,48,4168,347,111,236,185,238,281,173,235,51,1,81,131,7,66,104,Eucalyptus victrix,1995,Eucalyptus,Symphyomyrtus,Adnataria,Striolatae,NA,victrix,NA,NA,NA,NA,NA,NA,NA,NA,NA,NA,NA,NA,NA,NA,NA,NA,NA,NA,NA,NA,NA,NA
1183,114.05055555555555,-22.11861111111111,243,133,51,4534,371,115,256,192,259,299,182,259,47,1,74,116,7,100,85,Eucalyptus xerothermica,1995,Eucalyptus,Symphyomyrtus,Adnataria,Striolatae,NA,xerothermica,NA,NA,NA,NA,NA,NA,NA,NA,NA,NA,NA,NA,NA,NA,NA,NA,NA,NA,NA,NA,NA,NA
1187,117.51666666666667,-22.714166666666667,254,145,48,5566,398,98,300,314,259,319,177,337,70,3,77,184,12,172,51,Eucalyptus xerothermica,1995,Eucalyptus,Symphyomyrtus,Adnataria,Striolatae,NA,xerothermica,NA,NA,NA,NA,NA,NA,NA,NA,NA,NA,NA,NA,NA,NA,NA,NA,NA,NA,NA,NA,NA,NA
1202,127.625,-22.828055555555554,245,149,48,5770,387,79,308,309,184,309,165,253,45,5,64,125,19,125,26,Eucalyptus normantonensis,1995,Eucalyptus,Symphyomyrtus,Adnataria,Buxeales,Subplatyphyllae,normantonensis,NA,Eucalyptus normantonensis,NA,NA,mallee,NA,6,80,NA,3,5000,20,120,NA,4,5000,13,100,NA,3.5,"Usually a mallee to 5 m, sometimes a small tree to 8 m. Bark rough, subtessellated, grey on trunk, smooth and grey or brown on upper stems and branches. Juvenile leaves alternate or subopposite, narrowly lanceolate, green, concolorous. Adult leaves narrowly lanceolate, acuminate; lamina 8-12 cm long, 0.6-2 cm wide, shining, green; lateral veins faint, at 35°–45°; intramarginal vein up to 1 mm from margin; petiole terete or slightly flattened, 8-14 mm long. Umbels 7-flowered; peduncle quadrangular or terete, 10-15 mm long; pedicels 2-6 mm long. Buds clavate; operculum hemispherical or slightly apiculate, 1-2 mm long, 2-3 mm wide; hypanthium obonical, 2-3 mm long and wide. Fruits cylindrical to subglobular, 3-4 mm long and wide; disc narrow, descending; valves 3 or 4, included. Fig. 99H–I","Flora of Australia Volume 19, Myrtaceae, Eucalyptus, Angophora, Australian Government Publishing Service, Canberra (1988)"
1206,131.5602777777778,-23.204166666666666,221,154,48,5833,366,49,317,280,160,288,141,311,48,10,50,132,33,128,39,Eucalyptus camaldulensis subsp. arida,1995,Eucalyptus,Symphyomyrtus,Exsertaria,Exsertae,Rostratae,camaldulensis,arida,NA,NA,NA,NA,NA,NA,NA,NA,NA,NA,NA,NA,NA,NA,NA,NA,NA,NA,NA,NA,NA
1207,132.56722222222223,-23.635833333333334,209,157,48,6010,362,36,326,270,147,279,127,303,39,12,37,112,42,112,48,Eucalyptus normantonensis,1995,Eucalyptus,Symphyomyrtus,Adnataria,Buxeales,Subplatyphyllae,normantonensis,NA,Eucalyptus normantonensis,NA,NA,mallee,NA,6,80,NA,3,5000,20,120,NA,4,5000,13,100,NA,3.5,"Usually a mallee to 5 m, sometimes a small tree to 8 m. Bark rough, subtessellated, grey on trunk, smooth and grey or brown on upper stems and branches. Juvenile leaves alternate or subopposite, narrowly lanceolate, green, concolorous. Adult leaves narrowly lanceolate, acuminate; lamina 8-12 cm long, 0.6-2 cm wide, shining, green; lateral veins faint, at 35°–45°; intramarginal vein up to 1 mm from margin; petiole terete or slightly flattened, 8-14 mm long. Umbels 7-flowered; peduncle quadrangular or terete, 10-15 mm long; pedicels 2-6 mm long. Buds clavate; operculum hemispherical or slightly apiculate, 1-2 mm long, 2-3 mm wide; hypanthium obonical, 2-3 mm long and wide. Fruits cylindrical to subglobular, 3-4 mm long and wide; disc narrow, descending; valves 3 or 4, included. Fig. 99H–I","Flora of Australia Volume 19, Myrtaceae, Eucalyptus, Angophora, Australian Government Publishing Service, Canberra (1988)"
1209,133.85722222222222,-23.724999999999998,209,162,48,6048,369,35,334,280,147,280,127,282,37,9,43,111,35,111,42,Eucalyptus gillenii,1995,Eucalyptus,Symphyomyrtus,Exsertaria,Exsertae,Exsertae,gillenii,NA,Eucalyptus gillenii,NA,NA,mallee,NA,12,100,6,6,3000,25,150,12,15,3000,18.5,125,9,10.5,"Mallee to 3 m or tree to 6 m. Bark smooth throughout, white, grey or pale brown. Juvenile leaves narrowly to broadly lanceolate, grey-green, concolorous. Adult leaves lanceolate, sometimes falcate, acute to acuminate, thick; lamina 10-15 cm long, 1.2-2.5 cm wide, green; lateral veins at 40°–45°; intramarginal vein up to 1 mm from margin; petiole flattened or angular, 15-30 mm long. Umbels 7-flowered, occasionally 3-flowered, single or paired; peduncle thick, terete, 5-10 mm long; pedicels absent or to 4 mm long. Buds ovoid to obovoid or ±conical; operculum conical, 4-8 mm long, 3-6 mm wide; hypanthium hemispherical, 3-4 mm long, 3-6 mm wide. Fruits subglobular to ovoid, 6-15 mm long, 6-12 mm wide; disc broad, steeply ascending; valves 3-5, strongly exserted. Seeds brown-black. Fig. 92 I–J","Flora of Australia Volume 19, Myrtaceae, Eucalyptus, Angophora, Australian Government Publishing Service, Canberra (1988)"
1220,147.3011111111111,-33.90361111111111,166,130,44,5718,321,32,289,170,93,240,93,504,53,31,13,136,116,124,116,Eucalyptus microcarpa,1996,Eucalyptus,Symphyomyrtus,Adnataria,Subbuxeales,NA,microcarpa,NA,Eucalyptus microcarpa,NA,NA,tree,NA,10,80,3,3,25000,20,150,5,7,25000,15,115,4,5,"Tree to 25 m. Bark rough, fibrous on trunk and larger branches, grey, tessellated, then smooth and white above. Juvenile leaves ovate, green. Adult leaves lanceolate, acuminate; lamina 8-15 cm long, 1-2 cm wide, green; lateral veins faint or clearly visible, at 20°–30°; intramarginal vein up to 1 mm from margin; petiole terete, 10-15 mm long. Peduncle angular, 3-10 mm long; pedicels 1-5 mm long, occasionally absent. Buds fusiform; operculum conical, 2-3 mm long, 2-4 mm wide; hypanthium obconical, 3-4 mm long, 2-4 mm wide. Fruits ovoid to cylindrical, not ribbed, 3-7 mm long, 3-5 mm wide. Grey. Box. Fig. 103A–B","Flora of Australia Volume 19, Myrtaceae, Eucalyptus, Angophora, Australian Government Publishing Service, Canberra (1988)"
1223,149.35833333333332,-33.43527777777778,114,120,46,4930,255,-3,258,82,118,177,51,863,90,58,15,246,183,231,226,Eucalyptus rubida subsp. rubida,1996,Eucalyptus,Symphyomyrtus,Maidenaria,Viminales,Circulares,rubida,rubida,NA,NA,NA,NA,NA,NA,NA,NA,NA,NA,NA,NA,NA,NA,NA,NA,NA,NA,NA,NA,NA
1224,150.0302777777778,-33.46277777777778,115,111,46,4647,244,3,241,174,62,174,54,922,109,60,18,285,196,285,206,Eucalyptus aggregata,1996,Eucalyptus,Symphyomyrtus,Maidenaria,Foveolatae,NA,aggregata,NA,Eucalyptus aggregata,NA,NA,tree,NA,10,50,3,2,18000,20,120,5,3,18000,15,85,4,2.5,"Tree to 18 m. Bark rough, fibrous, hard throughout, grey. Juvenile leaves elliptic to ovate or broadly lanceolate, green, slightly discolorous. Adult leaves lanceolate to narrowly lanceolate, acuminate; lamina 5-12 cm long, 1-2 cm wide, green; lateral veins faint, at 15°–40°; intramarginal vein up to 3 mm from margin; petiole terete, 4-10 mm long. Umbels 7-flowered; peduncle terete, 3-4 mm long; pedicels absent or to 2 mm long. Buds ovoid to fusiform; operculum conical, 2-3 mm long and wide; hypanthium obconical, approx 2 mm long, 2-3 mm wide. Fruits obconical, 2-3 mm long, 3-5 mm wide; disc narrow, level; valves 3 or 4, exserted or level. Black. Gum. Fig. 93E–F","Flora of Australia Volume 19, Myrtaceae, Eucalyptus, Angophora, Australian Government Publishing Service, Canberra (1988)"
1225,150.11694444444444,-33.52027777777778,123,114,46,4645,251,6,245,181,69,181,61,870,107,50,21,278,175,278,182,Eucalyptus blaxlandii,1997,Eucalyptus,Eucalyptus,Eucalyptus,Pachyphloiae,NA,blaxlandii,NA,Eucalyptus blaxlandii,NA,NA,tree,NA,15,70,7,6,35000,20,120,12,8,35000,17.5,95,9.5,7,"Tree to 35 m. Bark grey-brown. Juvenile leaves ovate, green, slightly hairy on lower surface, discolorous. Adult leaves broadly lanceolate, apiculate to acuminate; lamina 7-12 cm long, 1.5-2 cm wide, shining, green, concolorous; lateral veins clearly visible, at 30°–40°; intramarginal vein up to 2 mm from margin; petiole channelled, 5-12 mm long. Umbels 7-11-flowered; peduncle terete or angular, 7-14 mm long; pedicels absent. Buds clavate; operculum hemispherical or rarely conical, 2-4 mm long, 3-5 mm wide; hypanthium obconical, 3-4 mm long, 3-5 mm wide. Fruits subglobular or hemispherical, 6-8 mm long, 7-12 mm wide; disc broad, convex, ascending; valves 4 or 5, exserted. Blaxland’s Stringybark. Fig. 56K–L","Flora of Australia Volume 19, Myrtaceae, Eucalyptus, Angophora, Australian Government Publishing Service, Canberra (1988)"
1226,150.10999999999999,-33.5475,124,115,46,4664,253,6,247,182,72,182,63,860,106,49,20,274,173,274,181,Eucalyptus pulverulenta,1996,Eucalyptus,Symphyomyrtus,Maidenaria,Viminales,Circulares,pulverulenta,NA,Eucalyptus pulverulenta,NA,NA,tree,NA,12,50,6,5,9000,19,100,10,9,9000,15.5,75,8,7,"Tree to 9 m, or straggly mallee to 5 m. Bark smooth throughout, bronze to grey. Juvenile leaves opposite, sessile, amplexicaul, orbicular to ovate, glaucous, concolorous, usually persisting on mature plants. Adult leaves rarely seen, alternate, lanceolate or oblong, apiculate; lamina 5-10 cm long, 1.2-1.9 cm wide, glaucous, concolorous; lateral veins faint, at 20°–35°; intramarginal vein up to 1 mm from margin; petiole terete, 10-18 mm long. Umbels 3-flowered; peduncle terete, 5-8 mm long; pedicels absent. Buds ovoid, glaucous; operculum conical, 2-3 mm long, 5-6 mm wide; hypanthium obconical, 5-6 mm long and wide. Fruits cylindrical to hemispherical, glaucous, 5-9 mm long, 6-10 mm wide; disc narrow, level; valves 3 or 4, level or slightly exserted. Silver-leaved. Mountain. Gum. Fig. 98C–D","Flora of Australia Volume 19, Myrtaceae, Eucalyptus, Angophora, Australian Government Publishing Service, Canberra (1988)"
1227,150.37166666666667,-33.7275,130,111,46,4506,250,12,238,182,79,185,70,1280,169,57,32,477,196,433,247,Eucalyptus baeuerlenii,1996,Eucalyptus,Symphyomyrtus,Maidenaria,Viminales,Lanceolatae,baeuerlenii,NA,Eucalyptus baeuerlenii,NA,NA,mallee,NA,10,90,6,6,9000,25,150,10,9,9000,17.5,120,8,7.5,"Mallee to 9 m, or occasionally tree to 18 m. Bark smooth throughout, red to grey-red, cream-green or brown. Juvenile leaves opposite, sessile, broadly lanceolate, green, discolorous. Adult leaves alternate, lanceolate, often falcate, acuminate, thin; lamina 9-15 cm long, 1-2.5 cm wide, green, concolorous; lateral veins faint, at 25°–35°; intramarginal vein up to 1 mm from margin; petiole terete or channelled, 7-17 mm long. Umbels 3-flowered; peduncle slightly angular or flattened, 1-5 mm long; pedicels absent. Buds subpyriform, often rostrate, sometimes warty; operculum conical to rostrate, 3-4 mm long, 4-6 mm wide; hypanthium cylindrical to obconical, 4-5 mm long, 4-6 mm wide. Fruits campanulate, often 1-ribbed, with flared rim, 6-9 mm long, 6-10 mm wide; disc narrow to moderately broad, level to slightly ascending; valves 3 or 4, exserted. Fig. 96S–T","Flora of Australia Volume 19, Myrtaceae, Eucalyptus, Angophora, Australian Government Publishing Service, Canberra (1988)"
1233,151.62972222222223,-31.706666666666667,146,126,50,4540,268,17,251,199,95,202,86,965,139,42,37,375,131,357,154,Eucalyptus moorei subsp. serpentinicola,1996,Eucalyptus,Eucalyptus,Eucalyptus,Longitudinales,NA,moorei,serpentinicola,NA,NA,NA,NA,NA,NA,NA,NA,NA,NA,NA,NA,NA,NA,NA,NA,NA,NA,NA,NA,NA
1235,151.62666666666667,-31.716944444444444,158,129,50,4509,281,27,254,210,106,213,98,931,137,38,40,369,120,351,139,Eucalyptus eugenioides,1996,Eucalyptus,Eucalyptus,Eucalyptus,Pachyphloiae,NA,eugenioides,NA,Eucalyptus eugenioides,NA,NA,tree,NA,25,100,5,4,30000,33,140,9,8,30000,29,120,7,6,"Tree to 30 m. Bark grey to brown. Juvenile leaves narrowly ovate, dark green, discolorous. Adult leaves lanceolate, acuminate; lamina 10-14 cm long, 2.5-3.3 cm wide, green, concolorous or slightly discolorous; lateral veins faint, at 20°–30°; intramarginal vein up to 3 mm from margin; petiole channelled, 10-17 mm long. Umbels 7-11-flowered, sometimes more; peduncle angular or flattened, 6-16 mm long; pedicels 1-5 mm long, sometimes absent. Buds fusiform; operculum conical, 2-4 mm long, 3-4 mm wide; hypanthium obconical, 2-3 mm long, 3-4 mm wide. Fruits hemispherical, globular or subglobular, 4-8 mm long, 5-9 mm wide; disc broad, just descending, level, convex, or slightly ascending; valves 3 or 4, included, level or exserted. Thin-leaved. Stringybark, White. Stringybark. Fig. 57C–D","Flora of Australia Volume 19, Myrtaceae, Eucalyptus, Angophora, Australian Government Publishing Service, Canberra (1988)"
1239,152.81361111111113,-31.283055555555556,178,105,50,3640,269,63,206,221,135,221,128,1417,181,51,36,510,174,455,246,Eucalyptus propinqua,1996,Eucalyptus,Symphyomyrtus,Exsertaria,Connexentes,NA,propinqua,NA,Eucalyptus propinqua,NA,NA,tree,NA,12,80,3,2,40000,27,140,6,5,40000,19.5,110,4.5,3.5,"Tree to 40 m. Bark grey gum type. Juvenile leaves lanceolate to broadly lanceolate. Adult leaves lanceolate, sometimes falcate; lamina 8-14 cm long, 1.2-2.7 cm wide; lateral veins just visible, at 45°–55°; intramarginal vein up to 1 mm from margin; petiole channelled, 10-15 mm long. Umbels 7-15-flowered; peduncle flattened, 5-15 mm long; pedicels angular, 2-5 mm long. Buds ovoid or clavate; operculum hemispherical or conical, 2-3 mm long, 3-4 mm wide; hypanthium hemispherical, 2-3 mm long, 3-4 mm wide. Fruits hemispherical or obconical, 2-5 mm long, 3-6 mm wide; disc moderately broad, level or ascending; valves 3 or 4, exserted. Seeds brown. Grey. Gum. Figs 9, 65 I–J","Flora of Australia Volume 19, Myrtaceae, Eucalyptus, Angophora, Australian Government Publishing Service, Canberra (1988)"
1241,153.06472222222223,-29.901666666666664,187,105,49,3762,280,67,213,230,143,232,135,1439,190,46,40,552,165,497,229,Eucalyptus bancroftii,1996,Eucalyptus,Symphyomyrtus,Exsertaria,'Liberivalvae' ms,NA,bancroftii,NA,Eucalyptus bancroftii,NA,NA,tree,NA,15,75,NA,5,30000,40,200,NA,9,30000,27.5,137.5,NA,7,"Tree to 30 m. Bark smooth throughout, pink or orange to grey-brown. Juvenile leaves ovate, green, discolorous. Adult leaves lanceolate to broadly lanceolate, acute, thick; lamina 7.5-20 cm long, 1.5-4 cm wide, green; lateral veins at 30°–60°; intramarginal vein up to 2 mm from margin; petiole terete or channelled, 12-25 mm long. Umbels 7-flowered; peduncle angular, 5-20 mm long; pedicels 2-5 mm long. Buds cylindrical; operculum cylindrical, 7-12 mm long, 4-5 mm wide; hypanthium hemispherical, 3-4 mm long, 4-6 mm wide. Fruits hemispherical to subglobular, often angular or ribbed, 5-9 mm long and wide; disc broad, convex; valves 3 or 4. Seeds red-brown. Orange. Gum, Bancroft’s Red. Gum. Fig. 90W–X","Flora of Australia Volume 19, Myrtaceae, Eucalyptus, Angophora, Australian Government Publishing Service, Canberra (1988)"
1242,153.06472222222223,-29.901666666666664,187,105,49,3762,280,67,213,230,143,232,135,1439,190,46,40,552,165,497,229,Eucalyptus tetrapleura,2000,Eucalyptus,Symphyomyrtus,Adnataria,Rhodoxyla,Concolores,tetrapleura,NA,Eucalyptus tetrapleura,NA,NA,tree,NA,15,120,6,9,30000,30,200,8,10,30000,22.5,160,7,9.5,"Tree to 30 m. Bark rough throughout, grey-brown to grey-black. Juvenile leaves lanceolate to ovate, green, concolorous. Adult leaves lanceolate, acuminate; lamina 12-20 cm long, 1.5-3 cm wide, green, concolorous; lateral veins just visible, at 40°–45°; intramarginal vein up to 1 mm from margin; petiole 20-30 mm long. Peduncle slightly flattened or angular, 15-30 mm long; pedicels angular, 8-12 mm long. Buds fusiform, 4-angled; operculum conical, often narrower than hypanthium, 6-7 mm long, 4-5 mm wide; hypanthium obconical, 6-7 mm long, 4-5 mm wide. Fruits obconical, 4-angled, 9-10 mm long, 6-8 mm wide; disc often obscure, descending; valves 4 or 5, included. Seeds suborbicular, ovoid or elliptic, grey brown. Square-fruited. Ironbark. Fig. 107 I–J","Flora of Australia Volume 19, Myrtaceae, Eucalyptus, Angophora, Australian Government Publishing Service, Canberra (1988)"
1243,153.06472222222223,-29.901666666666664,187,105,49,3762,280,67,213,230,143,232,135,1439,190,46,40,552,165,497,229,Eucalyptus tindaliae,1997,Eucalyptus,Eucalyptus,Eucalyptus,Pachyphloiae,NA,tindaliae,NA,Eucalyptus tindaliae,NA,NA,tree,NA,18,100,7,5,27000,30,130,10,7,27000,24,115,8.5,6,"Tree to 27 m. Bark grey to grey-brown. Juvenile leaves ovate, undulate, crenulate, green, strongly discolorous. Adult leaves lanceolate, falcate, acuminate, thick; lamina 10-13 cm long, 1.8-3 cm wide, green, slightly shining, concolorous; lateral veins clearly visible, at 20°–35°; intramarginal vein up to 2 mm from margin; petiole channelled, 10-15 mm long. Umbels 7-11-flowered or more; peduncle angular or flattened, 6-13 mm long; pedicels absent. Buds ovoid to clavate; operculum conical, sometimes obtuse, 2-3 mm long and wide; hypanthium obconical, approx 2 mm long, 2-3 mm wide. Fruits hemispherical or subglobular, 5-7 mm long, 7-10 mm wide; disc broad, convex, red; valves 4 or 5, ±level. Ramornie. Stringybark, Tindale’s Stringybark. Fig. 57A–B","Flora of Australia Volume 19, Myrtaceae, Eucalyptus, Angophora, Australian Government Publishing Service, Canberra (1988)"
1245,152.70499999999998,-28.93305555555556,186,125,52,4060,296,56,240,231,139,234,130,1142,179,37,47,473,124,469,142,Eucalyptus rummeryi,2000,Eucalyptus,Symphyomyrtus,Adnataria,Buxeales,Amissae,rummeryi,NA,Eucalyptus rummeryi,NA,NA,tree,NA,NA,NA,NA,3,40000,NA,NA,NA,4,40000,NA,NA,NA,3.5,"Tree to 40 m. Adult leaves: lamina 8-15 cm long, 1-2.5 cm wide; lateral veins faint, at 40°–50°; intramarginal vein up to 1 mm from margin; petiole channelled, 10-17 mm long. Peduncle angular, 6-12 mm long; pedicels 2-3 mm long. Operculum conical, 2-4 mm long, 2-3 mm wide; hypanthium usually obconical, 2-4 mm long, 2-3 mm wide. Fruits 3-4 mm long and wide. Brown. Box. Fig. 101A–B","Flora of Australia Volume 19, Myrtaceae, Eucalyptus, Angophora, Australian Government Publishing Service, Canberra (1988)"
1248,152.315,-28.924444444444447,152,115,50,4177,260,30,230,202,103,202,94,1180,164,47,41,469,156,469,167,Eucalyptus campanulata,2000,Eucalyptus,Eucalyptus,Eucalyptus,Psathyroxyla,Considenianae,campanulata,NA,NA,NA,NA,NA,NA,NA,NA,NA,NA,NA,NA,NA,NA,NA,NA,NA,NA,NA,NA,NA,NA
1249,151.97944444444445,-28.866944444444446,138,119,49,4483,254,12,242,192,77,192,77,964,120,51,31,352,166,352,166,Eucalyptus caliginosa,1997,Eucalyptus,Eucalyptus,Eucalyptus,Pachyphloiae,NA,caliginosa,NA,Eucalyptus caliginosa,NA,NA,tree,NA,20,100,4,6,27000,30,150,7,9,27000,25,125,5.5,7.5,"Tree to 27 m. Bark grey. Juvenile leaves ovate, undulate, green, discolorous. Adult leaves broadly lanceolate, falcate, acuminate, thick; lamina 10-15 cm long, 2-3 cm wide, green, slightly shining, concolorous; lateral veins just visible, at 15°–30°; intramarginal vein up to 2 mm from margin; petiole flattened or channelled, 7-12 mm long. Umbels 7-11-flowered or sometimes more; peduncle flattened, 7-15 mm long; pedicels 1-4 mm long. Buds fusiform or ovoid; operculum conical, 4-5 mm long and wide; hypanthium obconical, 2-3 mm long, 4-5 mm wide. Fruits hemispherical to subglobular, 6-9 mm long, 4-7 mm wide; disc broad, level or convex; valves 3 or 4, exserted. Broad-leaved. Stringybark. Fig. 57G–H","Flora of Australia Volume 19, Myrtaceae, Eucalyptus, Angophora, Australian Government Publishing Service, Canberra (1988)"
1254,151.70305555555555,-28.399444444444445,158,133,50,4840,284,18,266,216,92,216,92,749,96,36,31,271,127,271,127,Eucalyptus infera,1996,Eucalyptus,Symphyomyrtus,Exsertaria,Exsertae,Erythroxyla,infera,NA,NA,NA,NA,NA,NA,NA,NA,NA,NA,NA,NA,NA,NA,NA,NA,NA,NA,NA,NA,NA,NA
1255,151.92499999999998,-28.30027777777778,168,135,50,4707,292,25,267,224,103,224,103,698,95,28,37,265,107,265,107,Eucalyptus chloroclada,1996,Eucalyptus,Symphyomyrtus,Exsertaria,Exsertae,Erythroxyla,chloroclada,NA,Eucalyptus chloroclada,NA,NA,tree,NA,20,60,NA,4,15000,30,150,NA,6,15000,25,105,NA,5,"Tree or sometimes a mallee, to 15 m. Bark smooth throughout, cream, grey, white or cream-orange. Juvenile leaves orbicular to ovate, pale green, slightly discolorous. Adult leaves lanceolate, acute or acuminate, thin; lamina 6-15 cm long, 2-3 cm wide, dull or shining, green; lateral veins at 30°–45°; intramarginal vein up to 2 mm from margin; petiole terete or channelled, 10-22 mm long. Umbels 7-flowered; peduncle usually quadrangular, 6-10 mm long; pedicels 1-3 mm long. Buds conical; operculum conical, 4-7 mm long, 3-5 mm wide; hypanthium hemispherical or obconical, 4-7 mm long, 3-5 mm wide. Fruits hemispherical, 4-6 mm long and wide; disc broad, level or ascending; valves 4. Seeds brown-black. Baradine. Gum, Red. Gum. Fig. 91G–H","Flora of Australia Volume 19, Myrtaceae, Eucalyptus, Angophora, Australian Government Publishing Service, Canberra (1988)"
1257,152.3077777777778,-28.391111111111112,162,127,50,4337,279,29,250,213,112,213,102,984,128,40,37,372,140,372,153,Eucalyptus dunnii,1996,Eucalyptus,Symphyomyrtus,Maidenaria,Bridgesianae,NA,dunnii,NA,Eucalyptus dunnii,NA,NA,tree,NA,13,130,5,4,50000,25,200,8,5,50000,19,165,6.5,4.5,"Tree to 50 m. Bark rough, flaky or fibrous, grey to 4 m, then smooth and white to grey above. Juvenile leaves opposite to subopposite, sessile to shortly petiolate, ovate to suborbicular, cordate, crenulate, discolorous. Adult leaves alternate, lanceolate to narrowly lanceolate, acuminate; lamina 13-20 cm long, 1.3-2.5 cm wide, green, concolorous; lateral veins clearly visible, at 30°–45°; intramarginal vein up to 1 mm from margin; petiole terete or channelled, 22-40 mm long. Umbels 7-flowered; peduncle flattened, 7-16 mm long; pedicels angular, 1-5 mm long. Buds ovoid; operculum conical or hemispherical, apiculate, 3-4 mm long and wide; hypanthium hemispherical, 2-3 mm long, 3-4 mm wide. Fruits obconical or hemispherical, 4-5 mm long, 5-8 mm wide; disc broad, level or ascending; valves 3 or 4, exserted. Dunn’s White. Gum. Fig. 94 I–J","Flora of Australia Volume 19, Myrtaceae, Eucalyptus, Angophora, Australian Government Publishing Service, Canberra (1988)"
1260,151.15055555555557,-25.380833333333335,204,141,52,4510,324,55,269,255,153,255,140,739,104,28,42,293,97,293,106,Eucalyptus decorticans,1996,Eucalyptus,Symphyomyrtus,Adnataria,Siderophloiae,NA,decorticans,NA,Eucalyptus decorticans,NA,NA,tree,NA,10,85,NA,4,40000,15,120,NA,7,40000,12.5,102.5,NA,5.5,"Tree to 40 m. Bark rough on trunk and larger branches, grey to black, then smooth and white above. Juvenile leaves lanceolate, green, discolorous. Adult leaves narrowly lanceolate, acuminate; lamina 8.5-12 cm long, 1-1.5 cm wide, green to grey-green; lateral veins very faint, at 40°–50°; intramarginal vein confluent with or up to 1 mm from margin; petiole 12-20 mm long. Conflorescence axillary and terminal panicles, also axillary umbels; umbels 7-flowered; peduncle angular to slightly flattened, 5-18 mm long; pedicels 2-6 mm long. Buds clavate or fusiform; operculum conical, 3-4 mm long, 3-5 mm wide; hypanthium obconical, 3-4 mm long, 3-5 mm wide. Fruits ovoid to subcylindrical or almost hemispherical, occasionally faintly ribbed, 4-7 mm long and wide; disc narrow, convex, level or descending; valves 3 or 4, just included to just exserted. Gum-top. Ironbark. Fig. 104G–H","Flora of Australia Volume 19, Myrtaceae, Eucalyptus, Angophora, Australian Government Publishing Service, Canberra (1988)"
1261,151.1336111111111,-25.300555555555555,202,140,52,4474,321,54,267,253,151,253,139,750,107,28,43,301,98,301,107,Eucalyptus exserta,1996,Eucalyptus,Symphyomyrtus,Exsertaria,Exsertae,Exsertae,exserta,NA,Eucalyptus exserta,NA,NA,tree,NA,7,80,4,5,25000,17,180,9,8,25000,12,130,6.5,6.5,"Tree to 25 m. Bark rough, fibrous, hard, with longitudinal fissures on trunk and larger branches, then smooth and grey above. Juvenile leaves linear, green, concolorous. Adult leaves narrowly lanceolate to lanceolate, acute or acuminate, thin; lamina 8-18 cm long, 0.7-1.7 cm wide, slightly shining, green; lateral veins at 30°–40°; intramarginal vein up to 1 mm from margin; petiole terete or slightly flattened, 10-20 mm long. Umbels 7-flowered; peduncle thick, angular, 4-20 mm long; pedicels absent or angular, to 5 mm long. Buds ovoid or fusiform; operculum conical, 5-9 mm long, 4-6 mm wide; hypanthium obconical, 2-3 mm long, 4-6 mm wide. Fruits ovoid or subglobular, 5-8 mm long, 4-9 mm wide; disc broad, steeply ascending; valves usually 4, strongly exserted. Seeds brown-black. Queensland. Peppermint. Fig. 92E–F","Flora of Australia Volume 19, Myrtaceae, Eucalyptus, Angophora, Australian Government Publishing Service, Canberra (1988)"
